{
  "baseline_validation": {
    "decision_record_hash_valid": true,
    "decision_record_status": "accepted_with_warnings",
    "decision_record_valid": true,
    "evidence_record_status": "accepted_with_warnings",
    "evidence_record_valid": true
  },
  "catalog": {
    "catalog_id": "AEGIS-TAMPER-SCENARIO-CATALOG",
    "harness_version": "0.1.0",
    "relative_path": "policies/assurance/tamper_scenario_catalog_v1.yaml",
    "sha256": "572acb31d30d4ff34b887a86c73b2f07714eb015af833d2b715da9ab239e6a24",
    "version": "1.0.0"
  },
  "generated_at": "2026-07-13T20:16:14.918725+00:00",
  "harness_error_attack_ids": [],
  "input_integrity_checks_after": {
    "asset_context": {
      "actual_sha256": "bc9cb98980010ca2bc1c123e808296a2e17bb34a5735cf42cd07e1efcfc64395",
      "expected_sha256": "bc9cb98980010ca2bc1c123e808296a2e17bb34a5735cf42cd07e1efcfc64395",
      "passed": true,
      "relative_path": "data/sample_inputs/assets/valid_healthcare_asset.json"
    },
    "assurance_corpus": {
      "actual_sha256": "d51747056c4f920d5e0b6bfb51613b4e1ee1910de82770aa179dd3fe77f68ded",
      "expected_sha256": "d51747056c4f920d5e0b6bfb51613b4e1ee1910de82770aa179dd3fe77f68ded",
      "passed": true,
      "relative_path": "data/assurance/step11a_policy_rule_coverage_corpus.jsonl"
    },
    "assurance_manifest": {
      "actual_sha256": "d1fdd9308b973e5248e464daf528a376bca6bc6c27b9d45f267b88f842797465",
      "expected_sha256": "d1fdd9308b973e5248e464daf528a376bca6bc6c27b9d45f267b88f842797465",
      "passed": true,
      "relative_path": "data/assurance/step11a_policy_rule_coverage_manifest.json"
    },
    "decision_policy": {
      "actual_sha256": "fd5f39cec54f4bb57491d60bff9326f9b854209d3ab907cdab8768029a35447f",
      "expected_sha256": "fd5f39cec54f4bb57491d60bff9326f9b854209d3ab907cdab8768029a35447f",
      "passed": true,
      "relative_path": "policies/decision/federal_base_policy_v1.yaml"
    },
    "decision_record": {
      "actual_sha256": "82cc8dfa5d4c82cdb864e9d769236376ed34b3630f0a81ba9f31a244fb65a878",
      "expected_sha256": "82cc8dfa5d4c82cdb864e9d769236376ed34b3630f0a81ba9f31a244fb65a878",
      "passed": true,
      "relative_path": "data/sample_inputs/decisions/valid_log4shell_decision_record.json"
    },
    "decision_schema": {
      "actual_sha256": "e54a394ef9c772d3dce070f359051d6accf5761b1983ca9721e03e80a9e54ba3",
      "expected_sha256": "e54a394ef9c772d3dce070f359051d6accf5761b1983ca9721e03e80a9e54ba3",
      "passed": true,
      "relative_path": "schemas/aegis_decision_record.schema.json"
    },
    "evidence_record": {
      "actual_sha256": "21ed78284567bc33bb463fb2525941829b80c7e21144d17677f022d168a3c2de",
      "expected_sha256": "21ed78284567bc33bb463fb2525941829b80c7e21144d17677f022d168a3c2de",
      "passed": true,
      "relative_path": "data/sample_inputs/evidence/valid_log4j_sbom_evidence.json"
    },
    "evidence_schema": {
      "actual_sha256": "adaef9c4a1a837fddebee3d40cc03d6d99592682b3c42f1c24dded2fc74ce772",
      "expected_sha256": "adaef9c4a1a837fddebee3d40cc03d6d99592682b3c42f1c24dded2fc74ce772",
      "passed": true,
      "relative_path": "schemas/aegis_evidence_record.schema.json"
    },
    "step11a_assurance_report": {
      "actual_sha256": "6226d36646b0d00a22b9c7f4d7efcea216e705bbd1143b1caef07a97e41fd710",
      "expected_sha256": "6226d36646b0d00a22b9c7f4d7efcea216e705bbd1143b1caef07a97e41fd710",
      "passed": true,
      "relative_path": "data/validation_reports/assurance/step11a_policy_rule_coverage_report.json"
    },
    "step11a_release_report": {
      "actual_sha256": "3ab83f8962cc6b2dfa4014e59fb1c0a33f399e2b4bd29fa6f822de7ba19e6634",
      "expected_sha256": "3ab83f8962cc6b2dfa4014e59fb1c0a33f399e2b4bd29fa6f822de7ba19e6634",
      "passed": true,
      "relative_path": "data/validation_reports/fairness/step11a_rule_coverage_evaluation_report.json"
    },
    "step11b_mutation_report": {
      "actual_sha256": "73365a05f63fe4ee0cf51fed471c8a3846679f4ae737cc033be670220de5ceb1",
      "expected_sha256": "73365a05f63fe4ee0cf51fed471c8a3846679f4ae737cc033be670220de5ceb1",
      "passed": true,
      "relative_path": "data/validation_reports/mutation/step11b_policy_mutation_report.json"
    },
    "vulnerability_intelligence": {
      "actual_sha256": "e2204ab8ff8736c0826ffe24d518cef462a75dcea7e498943506b0fe7f41ff1f",
      "expected_sha256": "e2204ab8ff8736c0826ffe24d518cef462a75dcea7e498943506b0fe7f41ff1f",
      "passed": true,
      "relative_path": "data/sample_inputs/intelligence/valid_log4shell_intelligence.json"
    }
  },
  "input_integrity_checks_before": {
    "asset_context": {
      "actual_sha256": "bc9cb98980010ca2bc1c123e808296a2e17bb34a5735cf42cd07e1efcfc64395",
      "expected_sha256": "bc9cb98980010ca2bc1c123e808296a2e17bb34a5735cf42cd07e1efcfc64395",
      "passed": true,
      "relative_path": "data/sample_inputs/assets/valid_healthcare_asset.json"
    },
    "assurance_corpus": {
      "actual_sha256": "d51747056c4f920d5e0b6bfb51613b4e1ee1910de82770aa179dd3fe77f68ded",
      "expected_sha256": "d51747056c4f920d5e0b6bfb51613b4e1ee1910de82770aa179dd3fe77f68ded",
      "passed": true,
      "relative_path": "data/assurance/step11a_policy_rule_coverage_corpus.jsonl"
    },
    "assurance_manifest": {
      "actual_sha256": "d1fdd9308b973e5248e464daf528a376bca6bc6c27b9d45f267b88f842797465",
      "expected_sha256": "d1fdd9308b973e5248e464daf528a376bca6bc6c27b9d45f267b88f842797465",
      "passed": true,
      "relative_path": "data/assurance/step11a_policy_rule_coverage_manifest.json"
    },
    "decision_policy": {
      "actual_sha256": "fd5f39cec54f4bb57491d60bff9326f9b854209d3ab907cdab8768029a35447f",
      "expected_sha256": "fd5f39cec54f4bb57491d60bff9326f9b854209d3ab907cdab8768029a35447f",
      "passed": true,
      "relative_path": "policies/decision/federal_base_policy_v1.yaml"
    },
    "decision_record": {
      "actual_sha256": "82cc8dfa5d4c82cdb864e9d769236376ed34b3630f0a81ba9f31a244fb65a878",
      "expected_sha256": "82cc8dfa5d4c82cdb864e9d769236376ed34b3630f0a81ba9f31a244fb65a878",
      "passed": true,
      "relative_path": "data/sample_inputs/decisions/valid_log4shell_decision_record.json"
    },
    "decision_schema": {
      "actual_sha256": "e54a394ef9c772d3dce070f359051d6accf5761b1983ca9721e03e80a9e54ba3",
      "expected_sha256": "e54a394ef9c772d3dce070f359051d6accf5761b1983ca9721e03e80a9e54ba3",
      "passed": true,
      "relative_path": "schemas/aegis_decision_record.schema.json"
    },
    "evidence_record": {
      "actual_sha256": "21ed78284567bc33bb463fb2525941829b80c7e21144d17677f022d168a3c2de",
      "expected_sha256": "21ed78284567bc33bb463fb2525941829b80c7e21144d17677f022d168a3c2de",
      "passed": true,
      "relative_path": "data/sample_inputs/evidence/valid_log4j_sbom_evidence.json"
    },
    "evidence_schema": {
      "actual_sha256": "adaef9c4a1a837fddebee3d40cc03d6d99592682b3c42f1c24dded2fc74ce772",
      "expected_sha256": "adaef9c4a1a837fddebee3d40cc03d6d99592682b3c42f1c24dded2fc74ce772",
      "passed": true,
      "relative_path": "schemas/aegis_evidence_record.schema.json"
    },
    "step11a_assurance_report": {
      "actual_sha256": "6226d36646b0d00a22b9c7f4d7efcea216e705bbd1143b1caef07a97e41fd710",
      "expected_sha256": "6226d36646b0d00a22b9c7f4d7efcea216e705bbd1143b1caef07a97e41fd710",
      "passed": true,
      "relative_path": "data/validation_reports/assurance/step11a_policy_rule_coverage_report.json"
    },
    "step11a_release_report": {
      "actual_sha256": "3ab83f8962cc6b2dfa4014e59fb1c0a33f399e2b4bd29fa6f822de7ba19e6634",
      "expected_sha256": "3ab83f8962cc6b2dfa4014e59fb1c0a33f399e2b4bd29fa6f822de7ba19e6634",
      "passed": true,
      "relative_path": "data/validation_reports/fairness/step11a_rule_coverage_evaluation_report.json"
    },
    "step11b_mutation_report": {
      "actual_sha256": "73365a05f63fe4ee0cf51fed471c8a3846679f4ae737cc033be670220de5ceb1",
      "expected_sha256": "73365a05f63fe4ee0cf51fed471c8a3846679f4ae737cc033be670220de5ceb1",
      "passed": true,
      "relative_path": "data/validation_reports/mutation/step11b_policy_mutation_report.json"
    },
    "vulnerability_intelligence": {
      "actual_sha256": "e2204ab8ff8736c0826ffe24d518cef462a75dcea7e498943506b0fe7f41ff1f",
      "expected_sha256": "e2204ab8ff8736c0826ffe24d518cef462a75dcea7e498943506b0fe7f41ff1f",
      "passed": true,
      "relative_path": "data/sample_inputs/intelligence/valid_log4shell_intelligence.json"
    }
  },
  "limitations": [
    "The suite uses controlled repository fixtures rather than live operational systems.",
    "Cryptographic signature verification is policy-contract testing; no external PKI trust chain is exercised.",
    "Filesystem behavior is evaluated in the local Linux test environment and requires independent deployment testing.",
    "Passing Step 11C does not replace independent security assessment or authorization to operate."
  ],
  "quality_gates": [
    {
      "gate_id": "GATE-CRITICAL-TAMPER-DEFENCE",
      "observed": 1.0,
      "operator": "gte",
      "passed": true,
      "threshold": 1.0
    },
    {
      "gate_id": "GATE-UNDETECTED-CRITICAL",
      "observed": 0,
      "operator": "lte",
      "passed": true,
      "threshold": 0
    },
    {
      "gate_id": "GATE-HARNESS-ERRORS",
      "observed": 0,
      "operator": "lte",
      "passed": true,
      "threshold": 0
    },
    {
      "gate_id": "GATE-PATH-ESCAPE",
      "observed": 1.0,
      "operator": "gte",
      "passed": true,
      "threshold": 1.0
    },
    {
      "gate_id": "GATE-HASH-CORRUPTION",
      "observed": 1.0,
      "operator": "gte",
      "passed": true,
      "threshold": 1.0
    },
    {
      "gate_id": "GATE-IDENTITY-COLLISION",
      "observed": 1.0,
      "operator": "gte",
      "passed": true,
      "threshold": 1.0
    },
    {
      "gate_id": "GATE-TRUSTED-INPUT-INTEGRITY",
      "observed": true,
      "operator": "eq",
      "passed": true,